{
  "envelopeVersion": 1,
  "contract": "bg3-save",
  "contractVersion": 1,
  "capturedAt": "2026-10-22T19:15:01Z",
  "appVersion": "0.1.0",
  "collectorVersion": "0.1.0",
  "payload": {
    "saveName": "QuickSave_3",
    "savedAt": "2026-10-22T19:15:00Z",
    "campaignKey": "a1b2c3d4e5f60718a1b2c3d4e5f60718a1b2c3d4e5f60718a1b2c3d4e5f60718",
    "campaignKeySource": "save-folder",
    "gameVersion": "4.1.1.7631656",
    "platform": "Steam",
    "currentLevel": "WLD_Main_A",
    "difficulty": "DifficultyHard",
    "ruleset": null,
    "party": [
      {
        "origin": "Generic",
        "race": "Dwarf_Gold",
        "level": 3,
        "xpLevel": 300,
        "xpTotal": 2950,
        "classes": [
          {
            "main": "Fighter",
            "sub": null
          }
        ],
        "isSummon": false
      },
      {
        "origin": "Generic",
        "race": "HalfElf_High",
        "level": 3,
        "xpLevel": 300,
        "xpTotal": 2950,
        "classes": [
          {
            "main": "Warlock",
            "sub": "Fiend"
          }
        ],
        "isSummon": false
      }
    ],
    "thumbnail": {
      "sha256": "8d6272fcaf63cbc49f2eb9be3a83bba29d6464592d55fdfb49a41f1c4af7b9f7",
      "byteLength": 1698,
      "contentType": "image/webp",
      "width": 1280,
      "height": 720
    }
  }
}
